Top queries,Clicks,Impressions,CTR,Position
nutra thrive moringa powder,1,1,100%,1
best moringa powder,0,3,0%,7
can moringa grow in melbourne,0,2,0%,7
roosevelt moringa,0,2,0%,8.5
best quality moringa,0,1,0%,5
moringa powder best brand,0,1,0%,5
best brand moringa,0,1,0%,7
dried vs fresh curry leaves,0,1,0%,7
can you grow a moringa tree in a pot,0,1,0%,8
can you use dried curry leaves instead of fresh,0,1,0%,8
how to use dried curry leaves instead of fresh,0,1,0%,8
best moringa to take,0,1,0%,9
moringa tree lifespan,0,1,0%,9
what is the best moringa to take,0,1,0%,9
dried curry leaves uses,0,1,0%,11
dried curry leaves woolworths,0,1,0%,12
moringa reviews australia,0,1,0%,12
fresh curry leaves vs dried,0,1,0%,13