Top queries,Clicks,Impressions,CTR,Position
nutrithrive,5,10,50%,5.1
nutra thrive moringa powder,2,6,33.33%,1
nutri thrive,2,2,100%,1
best moringa to buy,1,2,50%,4
moringa tea near me,1,1,100%,1
best clean protein powder australia,0,41,0%,51.85
best moringa powder in australia,0,38,0%,4.92
best protein powder australia,0,38,0%,61.26
best protein powder,0,24,0%,93.62
best organic protein powder australia,0,22,0%,51.59
best organic protein powder,0,22,0%,83.64
best moringa powder,0,18,0%,7.72
roosevelt moringa,0,12,0%,8.83
what is moringa good for,0,12,0%,87.58
best pure protein powder,0,11,0%,84.73
best protein shakes australia,0,8,0%,67.62
fresh vs dried curry leaves,0,7,0%,8.29
best protein shake australia,0,7,0%,64.14
best moringa leaf powder,0,6,0%,6.5
dried curry leaves vs fresh,0,6,0%,9.67
dried curry leaves woolworths,0,6,0%,10
how to use curry leaves,0,6,0%,44.33
which moringa is the best,0,5,0%,8
fresh curry leaves vs dried,0,5,0%,9.8
can moringa grow in melbourne,0,4,0%,7
best quality moringa powder,0,4,0%,7.5
best moringa,0,4,0%,8
can you use dried curry leaves instead of fresh,0,4,0%,9.25
moringa powder,0,4,0%,28.25
how to store curry leaves,0,4,0%,39.25
high protein snacks australia,0,4,0%,61.75
best protein powders australia,0,4,0%,62.75
best protein powder for weight loss,0,4,0%,95.25
is rosabella moringa legit,0,3,0%,2
rosabella moringa australia,0,3,0%,2
is rosabella moringa the same as moringa,0,3,0%,3
osmo moringa australia,0,3,0%,3.33
rosabella moringa reviews,0,3,0%,3.33
best organic moringa powder,0,3,0%,6.33
moringa best brand,0,3,0%,6.67
are dried curry leaves as good as fresh,0,3,0%,7
best moringa in australia,0,3,0%,7.33
moringa reviews australia,0,3,0%,8
the best moringa,0,3,0%,8.33
how to use dried curry leaves instead of fresh,0,3,0%,9.33
how to use dry curry leaves,0,3,0%,9.67
moringa tree lifespan,0,3,0%,13
curry leaf recipes,0,3,0%,50.33
moringa or matcha,0,3,0%,53.67
cooking with curry leaves,0,3,0%,55
moringa tree,0,3,0%,72.33
natural moringa powder,0,3,0%,83.33
thrive,0,2,0%,1.5
moringa chemist warehouse,0,2,0%,2
moringa powder coles,0,2,0%,2
best moringa supplement,0,2,0%,3
coco earth moringa oil reviews,0,2,0%,3
osmo moringa capsules,0,2,0%,3
osmo moringa reviews,0,2,0%,3
rosabella moringa capsules chemist warehouse,0,2,0%,3
best quality moringa,0,2,0%,5
thrive powder,0,2,0%,7
using dried curry leaves instead of fresh,0,2,0%,7
best moringa products,0,2,0%,9
what to do with dried curry leaves,0,2,0%,10
which is the best moringa to take,0,2,0%,10.5
can i use dried curry leaves,0,2,0%,12
curry leaves,0,2,0%,14
moringa capsules woolworths,0,2,0%,31
curry leaves melbourne,0,2,0%,33.5
moringa plant australia,0,2,0%,33.5
moringa powder australia,0,2,0%,36.5
protein powder reviews australia,0,2,0%,38
best moringa capsules australia,0,2,0%,40.5
moringa near me,0,2,0%,41.5
thrive protein powder,0,2,0%,43.5
how to grow moringa tree,0,2,0%,44.5
150 calorie snacks,0,2,0%,45
protein powder comparison,0,2,0%,45.5
curry leaves health benefits,0,2,0%,46
moringa vs matcha,0,2,0%,47
uses for curry leaves,0,2,0%,49.5
health benefits of curry leaves,0,2,0%,51
top protein powders australia,0,2,0%,51.5
dried curry leaves,0,2,0%,53.5
best pea protein powder australia,0,2,0%,54
moringa powder how to use,0,2,0%,55
best protein powder in australia,0,2,0%,58.5
best protein supplements australia,0,2,0%,59
curry leaves recipe,0,2,0%,59
best protein powder for women australia,0,2,0%,60.5
how to use moringa powder,0,2,0%,64
best whey protein australia,0,2,0%,68
best value protein powder,0,2,0%,69.5
difference between matcha and moringa,0,2,0%,70
best protein supplement brand,0,2,0%,71
top protein powder australia,0,2,0%,73.5
best plant based protein powder australia,0,2,0%,83
protein powder best quality,0,2,0%,87
best protein supplement,0,2,0%,87.5
compare protein powder,0,2,0%,87.5
top protein powders,0,2,0%,88
what is moringa powder,0,2,0%,92.5
the best protein powder,0,2,0%,96
moringa,0,2,0%,99
best brand moringa,0,1,0%,1
what is the best moringa to buy,0,1,0%,1
best place to buy moringa,0,1,0%,2
moringa capsules,0,1,0%,2
moringa coles,0,1,0%,2
moringa oil,0,1,0%,2
moringa reviews,0,1,0%,2
nutrali moringa,0,1,0%,2
nutrawave moringa,0,1,0%,2
rosabella moringa,0,1,0%,2
rosabella moringa powder chemist warehouse,0,1,0%,2
rosabella moringa reviews and complaints,0,1,0%,2
where to buy moringa leaves,0,1,0%,2
best moringa product on the market,0,1,0%,3
moringa rosabella reviews,0,1,0%,3
moringa tablets chemist warehouse,0,1,0%,3
moringa tablets woolworths,0,1,0%,3
osmo moringa,0,1,0%,3
where to buy rosabella moringa,0,1,0%,3
which is the best moringa powder brand,0,1,0%,4
best moringa powder in the world,0,1,0%,5
best moringa powder reviews 2025,0,1,0%,5
moringa powder best quality,0,1,0%,5
the best organic moringa powder,0,1,0%,5
thrive 24/7,0,1,0%,5
best moringa powder brand,0,1,0%,6
moringa powder best brand,0,1,0%,6
moringa powder best brands,0,1,0%,6
high quality moringa,0,1,0%,7
keto atta near me,0,1,0%,7
moringa powder best company,0,1,0%,7
where can i buy moringa powder near me,0,1,0%,7
which brand moringa powder is best,0,1,0%,7
best moringa brand,0,1,0%,8
curry leaf storage,0,1,0%,8
dry curry leaves vs fresh,0,1,0%,8
dried vs fresh curry leaves,0,1,0%,9
moringa tree in pot,0,1,0%,9
how to use dried curry leaves,0,1,0%,10
moringa leaves melbourne,0,1,0%,10
the best moringa on the market,0,1,0%,10
best moringa powder brands,0,1,0%,11
wild taste australia moringa powder reviews,0,1,0%,11
adaptogen superfoods,0,1,0%,12
can you grow moringa in a pot,0,1,0%,12
curry leaves recipes indian,0,1,0%,13
dry curry leaves benefits,0,1,0%,13
murraya koenigii health benefits,0,1,0%,13
carry leaves,0,1,0%,14
atta near me,0,1,0%,27
thrive protein,0,1,0%,28
moringa powder chemist warehouse,0,1,0%,29
which is better matcha or moringa,0,1,0%,33
moringa tree australia,0,1,0%,35
curry leaf for cooking,0,1,0%,37
where to buy moringa tree in australia,0,1,0%,38
protein powder australia reviews,0,1,0%,43
150 calories snacks,0,1,0%,45
best vegan protein powder australia,0,1,0%,47
full grown moringa tree,0,1,0%,47
best tasting protein powder australia,0,1,0%,48
best value protein powder australia,0,1,0%,49
curry leaves benefits,0,1,0%,49
how to use curry leaves in cooking,0,1,0%,49
benefits of curry leaves,0,1,0%,50
curry patta benefits,0,1,0%,50
best protein powder australia for muscle growth,0,1,0%,51
curry leaf health benefits,0,1,0%,51
curry leaves advantages,0,1,0%,51
best protein powder brand,0,1,0%,52
is matcha the same as moringa,0,1,0%,52
matcha vs moringa,0,1,0%,52
best whey protein powder australia,0,1,0%,54
best protein powder australia for weight loss,0,1,0%,56
best protein powder brands,0,1,0%,56
using curry leaves in cooking,0,1,0%,57
best natural protein powder,0,1,0%,58
best weight loss protein powder australia,0,1,0%,59
curry tree benefits,0,1,0%,59
dry curry leaves,0,1,0%,59
good natural protein powder,0,1,0%,59
amazonia raw protein woolworths,0,1,0%,60
how to use the moringa powder,0,1,0%,61
best wpi australia,0,1,0%,62
best wpi protein australia,0,1,0%,62
how to consume moringa powder,0,1,0%,62
brands of protein powder,0,1,0%,63
is moringa like matcha,0,1,0%,63
pure moringa powder,0,1,0%,63
best australian protein powder,0,1,0%,64
best protein australia,0,1,0%,64
best protein powder for weight loss australia,0,1,0%,66
best plant protein powder australia,0,1,0%,67
fresh curry leaves,0,1,0%,67
moringa leaf powder australia,0,1,0%,67
good protein powder brands,0,1,0%,68
protein powder reviews,0,1,0%,68
recipes using curry leaves,0,1,0%,68
highest quality protein powder,0,1,0%,69
how to take moringa powder,0,1,0%,69
best protein powder for elderly australia,0,1,0%,71
best wpi protein powder australia,0,1,0%,71
is moringa and matcha the same thing,0,1,0%,71
best protein supplement brands,0,1,0%,72
best whey protein in australia,0,1,0%,72
how do you use moringa powder,0,1,0%,73
protein powder best value,0,1,0%,73
how can i use moringa powder,0,1,0%,74
natural nutri powder,0,1,0%,74
best vanilla protein powder australia,0,1,0%,76
how much moringa powder per day,0,1,0%,78
protein powder brands,0,1,0%,78
protein supplements brands,0,1,0%,78
uses of curry leaves,0,1,0%,79
plant protein powder best,0,1,0%,80
top quality protein powder,0,1,0%,80
best protein powder natural,0,1,0%,81
protein supplement brands,0,1,0%,83
what is the best whey protein powder,0,1,0%,83
best plant-based protein powder australia,0,1,0%,84
how do you take moringa powder,0,1,0%,84
best brands of protein powder,0,1,0%,85
best protein powder for men,0,1,0%,86
best quality protein powder,0,1,0%,86
protein brands,0,1,0%,86
protein powder review,0,1,0%,86
the best protein supplement,0,1,0%,86
does moringa help with sugar cravings,0,1,0%,87
high quality protein powder,0,1,0%,87
review protein powder,0,1,0%,87
best natural protein supplement,0,1,0%,88
best tasting protein powder,0,1,0%,88
black tea health benefits,0,1,0%,88
moringa product,0,1,0%,88
protein powders reviews,0,1,0%,89
protein supplement reviews,0,1,0%,89
what is the healthiest protein powder,0,1,0%,89
which are the best protein powders,0,1,0%,89
is moringa powder good for you,0,1,0%,90
moringa post-workout supplement,0,1,0%,91
top protein powder,0,1,0%,91
best protein supplements brands,0,1,0%,92
which whey protein powder is best,0,1,0%,92
is black tea healthy,0,1,0%,93
spirulina vs moringa,0,1,0%,93
top protein supplements,0,1,0%,94
cleanest protein powder australia,0,1,0%,95
what protein powder is best,0,1,0%,95
benefit of moringa,0,1,0%,96
moringa plants,0,1,0%,96
which protein supplement is best,0,1,0%,96
best protein supplements,0,1,0%,97
black tea good for,0,1,0%,97
buy a moringa tree,0,1,0%,97
curry leaves curry,0,1,0%,97
protein powders best,0,1,0%,97
healthiest protein powder,0,1,0%,98
what's the best protein powder,0,1,0%,98
what's the best protein supplement,0,1,0%,98
best protein powders organic,0,1,0%,99
best whey protein,0,1,0%,100
black tea is good for what,0,1,0%,100
good quality protein powder,0,1,0%,100